{
  "task_id": "bmad-mapping-demo",
  "map_id": "demo-prd-map",
  "kind": "prd",
  "created_at": "2026-05-13T01:27:13Z",
  "updated_at": "2026-05-13T01:27:13Z",
  "sources": [
    {
      "path": "examples\\bmad-mapping-demo\\PRD.md",
      "exists": true,
      "sha256": "0f7e6d6d2da9b531a0541f46596598e0daa21157f8affdc90e8f7e4a6e8e899a",
      "size": 774,
      "modified_at": "2026-05-13T01:26:40Z"
    }
  ],
  "sections": [
    {
      "path": "examples\\bmad-mapping-demo\\PRD.md",
      "headings": [
        "1:PRD: CLI Evidence Dashboard",
        "2:Problem Statement",
        "2:Product Goal",
        "2:Users",
        "2:Acceptance Criteria",
        "2:Out of Scope",
        "2:Open Questions"
      ]
    }
  ],
  "gaps": [
    "Default limit needs product decision"
  ],
  "next_read": [
    "examples\\bmad-mapping-demo\\PRD.md"
  ],
  "context_id": "demo-prd-map-context"
}
