{
  "task_id": "bmad-mapping-demo",
  "map_id": "demo-project-context-map",
  "kind": "project-context",
  "created_at": "2026-05-13T01:27:13Z",
  "updated_at": "2026-05-13T01:27:13Z",
  "sources": [
    {
      "path": "examples\\bmad-mapping-demo\\project-context.md",
      "exists": true,
      "sha256": "e0f4810d215f21933155cde4855a9a95bc481dfc61f2b10644e9b7d91a42c8b3",
      "size": 443,
      "modified_at": "2026-05-13T01:26:40Z"
    }
  ],
  "sections": [
    {
      "path": "examples\\bmad-mapping-demo\\project-context.md",
      "headings": [
        "1:Project Context",
        "2:Technology Stack & Versions",
        "2:Critical Implementation Rules",
        "2:Testing"
      ]
    }
  ],
  "gaps": [],
  "next_read": [
    "examples\\bmad-mapping-demo\\project-context.md"
  ],
  "context_id": "demo-project-context-map-context"
}
