{
  "task_id": "yunshu-full-test-2026",
  "map_id": "yunshu-full-test-2026-prd-20260529-091303",
  "kind": "prd",
  "created_at": "2026-05-29T01:13:03Z",
  "updated_at": "2026-05-29T01:13:03Z",
  "sources": [
    {
      "path": "templates/bmad_prd_map.md",
      "exists": true,
      "sha256": "d7c8d14ca44ba68cbbad9d1aa6bb5fa50ca59558963e5937b3b909319b61ef46",
      "size": 970,
      "modified_at": "2026-05-12T14:04:11Z"
    },
    {
      "path": "templates/bmad_architecture_map.md",
      "exists": true,
      "sha256": "bf960fe342ec713f031b265d74909e48c1ea6f4181cc1b7e1bbbe34b56043e03",
      "size": 1150,
      "modified_at": "2026-05-12T14:04:11Z"
    }
  ],
  "sections": [
    {
      "path": "templates/bmad_prd_map.md",
      "headings": [
        "1:BMad PRD Map",
        "2:1. 基本信息",
        "2:2. 目标对齐",
        "2:3. 用户与场景",
        "2:4. 验收标准映射",
        "2:5. 约束、假设和风险",
        "3:硬约束",
        "3:假设",
        "3:风险",
        "2:6. 非目标",
        "2:7. 开放问题",
        "2:8. 下一步"
      ]
    },
    {
      "path": "templates/bmad_architecture_map.md",
      "headings": [
        "1:BMad Architecture Map",
        "2:1. 基本信息",
        "2:2. 模块边界",
        "2:3. 接口契约",
        "2:4. 数据流与数据归属",
        "2:5. 技术约束",
        "2:6. ADR",
        "3:ADR-001:",
        "2:7. 测试策略",
        "2:8. 回滚点",
        "2:9. 缺口"
      ]
    }
  ],
  "gaps": [
    "需验证BMad映射与context ledger的自动关联"
  ],
  "next_read": [
    "templates/bmad_prd_map.md",
    "templates/bmad_architecture_map.md"
  ],
  "context_id": "yunshu-full-test-2026-prd-20260529-091303-context"
}
