{
  "task_id": "bmad-mapping-demo",
  "map_id": "demo-story-map",
  "kind": "story",
  "created_at": "2026-05-13T01:27:13Z",
  "updated_at": "2026-05-13T01:27:13Z",
  "sources": [
    {
      "path": "examples\\bmad-mapping-demo\\story-cli-evidence-dashboard.md",
      "exists": true,
      "sha256": "6740a88259a2ecaa49d574757a22875a673b560d7b1331abea046dcb9fa48a2b",
      "size": 649,
      "modified_at": "2026-05-13T01:26:40Z"
    },
    {
      "path": "examples\\bmad-mapping-demo\\project-context.md",
      "exists": true,
      "sha256": "e0f4810d215f21933155cde4855a9a95bc481dfc61f2b10644e9b7d91a42c8b3",
      "size": 443,
      "modified_at": "2026-05-13T01:26:40Z"
    }
  ],
  "sections": [
    {
      "path": "examples\\bmad-mapping-demo\\story-cli-evidence-dashboard.md",
      "headings": [
        "1:Story: Summarize Verification Evidence",
        "2:User Story",
        "2:Acceptance Criteria",
        "2:Dev Notes",
        "2:Tasks"
      ]
    },
    {
      "path": "examples\\bmad-mapping-demo\\project-context.md",
      "headings": [
        "1:Project Context",
        "2:Technology Stack & Versions",
        "2:Critical Implementation Rules",
        "2:Testing"
      ]
    }
  ],
  "gaps": [],
  "next_read": [
    "examples\\bmad-mapping-demo\\story-cli-evidence-dashboard.md",
    "examples\\bmad-mapping-demo\\project-context.md"
  ],
  "context_id": "demo-story-map-context"
}
